[
  {
    "id": "social:x-yibie-status-2102797612474638410",
    "title": "awesome-jev periodic review: 22 new entries",
    "titleZh": "awesome-jev 周期巡检：新增 22 条",
    "contentType": "social_post",
    "platform": "X",
    "creator": "yibie / @yibie",
    "published": "2026-09-23",
    "relation": "mentions_only",
    "confidence": "verified",
    "status": "published",
    "isOriginal": true,
    "summaryEn": "A periodic review post announcing 22 new entries in the author's awesome-jev directory, including OpenViking, Dub, jev-chat, SemIf, jev-trader, hermes-jev-skills, simple-jev, cu-Jev, jev-foundation-models, jevcache, jev-browser-use, mobile-jev, Jev-cu, jev-screen-mcp, and jev-resume-disqualifier.",
    "summaryZh": "作者发布的 awesome-jev 周期巡检，宣布新增 22 条，并列出 OpenViking、Dub、jev-chat、SemIf、jev-trader、hermes-jev-skills、simple-jev、cu-Jev、jev-foundation-models、jevcache、jev-browser-use、mobile-jev、Jev-cu、jev-screen-mcp 与 jev-resume-disqualifier 等条目。",
    "evidenceNote": "The public X status was fetched directly on 2026-09-24. The post is evidence of the author's directory update, not independent verification of every listed project.",
    "canonicalUrl": "https://x.com/yibie/status/2102797612474638410",
    "sourceIds": [
      "source:x-yibie-awesome-jev"
    ],
    "lastVerifiedAt": "2026-09-24",
    "topics": [
      "awesome-jev",
      "project discovery",
      "periodic review"
    ]
  },
  {
    "id": "blog:typesafe:system-one-jev",
    "title": "Introducing System One Models & Jev",
    "titleZh": "发布 System One 模型与 Jev",
    "contentType": "blog",
    "platform": "TypeSafe AI Blog",
    "creator": "Diogo Almeida / TypeSafe AI",
    "published": "2026-09-15",
    "relation": "uses_jev",
    "confidence": "verified",
    "status": "published",
    "isOriginal": true,
    "summaryEn": "The official launch article defines Jev as TypeSafe AI’s first public System One model and describes typed probabilistic decisions, calibration, and intended software use cases. Vendor-reported performance and pricing remain recorded as claims made by the publisher.",
    "summaryZh": "官方发布文章将 Jev 定义为 TypeSafe AI 首个公开的 System One 模型，介绍类型化概率决策、校准及软件使用场景。性能与价格数字按发布方主张记录。",
    "evidenceNote": "Primary TypeSafe AI publication. Product claims are not treated as independent benchmark evidence.",
    "canonicalUrl": "https://typesafe.ai/blog/introducing-system-one-models-and-jev",
    "sourceIds": [
      "source:typesafe-blog"
    ],
    "lastVerifiedAt": "2026-09-24",
    "topics": [
      "official announcement",
      "System One",
      "calibration"
    ]
  },
  {
    "id": "interview:latent-space:jev",
    "title": "Jev: System One models for Prod, not God — with Diogo Almeida",
    "titleZh": "Jev：面向生产而非上帝的 System One 模型——Diogo Almeida 访谈",
    "contentType": "podcast",
    "platform": "Latent Space",
    "creator": "Swyx · Diogo Almeida",
    "published": "2026-09-21",
    "relation": "uses_jev",
    "confidence": "verified",
    "status": "published",
    "isOriginal": true,
    "summaryEn": "A long-form podcast interview with TypeSafe AI co-founder Diogo Almeida covering Jev’s product rationale, reliability, calibration, System One versus System Two tasks, and early use cases.",
    "summaryZh": "Latent Space 对 TypeSafe AI 联合创始人 Diogo Almeida 的长篇访谈，讨论 Jev 的产品动机、可靠性、校准、System One 与 System Two 任务边界及早期应用。",
    "evidenceNote": "The episode page provides the publication date, named guest, audio, and a full transcript. Statements in the interview remain attributed to the speakers.",
    "canonicalUrl": "https://www.latent.space/p/jev",
    "sourceIds": [
      "source:latent-space-jev"
    ],
    "lastVerifiedAt": "2026-09-24",
    "topics": [
      "interview",
      "reliability",
      "calibration"
    ]
  },
  {
    "id": "blog:baader:jev-first-three-days",
    "title": "Jev by TypeSafe AI: What We Found Testing It on Real Work",
    "titleZh": "TypeSafe AI 的 Jev：在真实工作中测试三天后的发现",
    "contentType": "blog",
    "platform": "Baader",
    "creator": "Jesse Ayala",
    "published": "2026-09-19",
    "relation": "uses_jev",
    "confidence": "verified",
    "status": "published",
    "isOriginal": true,
    "summaryEn": "An independent three-day field report describing Jev tests on a live application and an internal document set. It separates measured latency, cost, and reliability from unresolved decision accuracy.",
    "summaryZh": "一份独立的三天实践报告，记录 Jev 在实时应用和内部文档集上的测试，并将测得的延迟、成本、可靠性与尚未解决的决策准确性分开。",
    "evidenceNote": "The author reports procedures and measurements from their own workload and explicitly labels accuracy as unresolved. These results are not generalized beyond the reported setup.",
    "canonicalUrl": "https://baaderagency.com/blog/jev-typesafe-ai-first-three-days",
    "sourceIds": [
      "source:baader-jev-report"
    ],
    "lastVerifiedAt": "2026-09-24",
    "topics": [
      "independent report",
      "latency",
      "cost",
      "evaluation"
    ]
  },
  {
    "id": "directory:traeai:jev-topic",
    "title": "Jev (TypeSafe System One): model, decision AI, and ecosystem tracking",
    "titleZh": "Jev（TypeSafe System One）：模型、决策 AI 与生态追踪",
    "contentType": "directory",
    "platform": "TraeAI",
    "creator": "TraeAI editorial team",
    "published": "2026-09-19",
    "relation": "mentions_only",
    "confidence": "probable",
    "status": "published",
    "isOriginal": true,
    "summaryEn": "A Chinese-language third-party tracking page that aggregates official announcements, documentation, projects, evaluations, and public discussion. It is a discovery and comparison source, not a primary record for the claims it lists.",
    "summaryZh": "中文第三方追踪页面，汇总官方发布、文档、项目、评测与公开讨论；本目录将其作为发现与对照来源，而非所列事实的一手记录。",
    "evidenceNote": "Useful for discovery and cross-checking. Individual items require their own primary URL before being promoted to verified evidence.",
    "canonicalUrl": "https://www.traeai.com/topics/jev",
    "sourceIds": [
      "source:traeai"
    ],
    "lastVerifiedAt": "2026-09-24",
    "topics": [
      "Chinese coverage",
      "discovery",
      "ecosystem"
    ]
  },
  {
    "id": "social:x:typesafe-launch",
    "title": "TypeSafe AI launch announcement on X",
    "titleZh": "TypeSafe AI 在 X 上的发布公告",
    "contentType": "social_post",
    "platform": "X",
    "creator": "TypeSafe AI / @CompleteSkeptic",
    "published": "2026-09-15",
    "relation": "uses_jev",
    "confidence": "probable",
    "status": "published",
    "isOriginal": true,
    "summaryEn": "A launch-day X post linked from an independent timeline of Jev’s public release. The post is preserved as public context; technical claims should be checked against the official article and documentation.",
    "summaryZh": "独立时间线链接的 Jev 发布日 X 帖子。此处保留其作为公开传播背景；技术主张仍应回到官方文章与文档核验。",
    "evidenceNote": "The X endpoint was not directly machine-readable during review; the stable post URL and date were corroborated by the cited third-party timeline.",
    "canonicalUrl": "https://x.com/CompleteSkeptic/status/2099925682726002904",
    "sourceIds": [
      "source:typesafe-x",
      "source:traeai"
    ],
    "lastVerifiedAt": "2026-09-24",
    "topics": [
      "launch",
      "social media",
      "public statement"
    ]
  },
  {
    "id": "social:x:vercel-jev-report",
    "title": "Vercel CEO report on a Jev safety-review workload",
    "titleZh": "Vercel CEO 关于 Jev 安全审查负载的公开报告",
    "contentType": "social_post",
    "platform": "X",
    "creator": "Guillermo Rauch / @rauchg",
    "published": "2026-09-16",
    "relation": "uses_jev",
    "confidence": "probable",
    "status": "published",
    "isOriginal": true,
    "summaryEn": "A public post cited by an independent timeline as a report of Jev performance on a particular Vercel workload. It is retained as an author-reported observation, not a general benchmark.",
    "summaryZh": "独立时间线引用的一条公开帖子，报告 Jev 在某项 Vercel 负载上的表现。本条作为作者报告的观察保留，不视为通用基准。",
    "evidenceNote": "The X endpoint returned an access error during review; the URL and date were retained with probable rather than verified evidence.",
    "canonicalUrl": "https://x.com/rauchg/status/2100307962262872105",
    "sourceIds": [
      "source:typesafe-x",
      "source:traeai"
    ],
    "lastVerifiedAt": "2026-09-24",
    "topics": [
      "production report",
      "social media",
      "latency"
    ]
  },
  {
    "id": "social:madewithjev:competitor-ad-teardown",
    "title": "724 competitor advertisements analysed with Jev",
    "titleZh": "使用 Jev 分析 724 条竞品广告",
    "contentType": "social_post",
    "platform": "X · Made with Jev",
    "creator": "Matthew Berman / @TheMattBerman",
    "published": "2026-09-17",
    "relation": "uses_jev",
    "confidence": "probable",
    "status": "published",
    "isOriginal": false,
    "summaryEn": "A curated public record of an X post reporting a Jev-assisted analysis of 724 live advertisements from 37 brands. All timing and cost figures remain the author’s report.",
    "summaryZh": "公开目录收录的一条 X 帖子，报告使用 Jev 分析 37 个品牌的 724 条广告。时间与成本数字均属于作者自报。",
    "evidenceNote": "The canonical record is a Made with Jev page that preserves the post text, author, date, and source link. It is a secondary record until the original post is independently fetched.",
    "canonicalUrl": "https://madewithjev.com/builds/competitor-ad-teardown",
    "originalUrl": "https://x.com/TheMattBerman/status/2100654891756589230",
    "sourceIds": [
      "source:madewithjev"
    ],
    "lastVerifiedAt": "2026-09-24",
    "topics": [
      "social media",
      "content analysis",
      "author-reported metric"
    ]
  },
  {
    "id": "social:madewithjev:superx-post-scoring",
    "title": "Post scoring with SuperX",
    "titleZh": "使用 SuperX 对社交帖子评分",
    "contentType": "social_post",
    "platform": "X · Made with Jev",
    "creator": "Rob Hallam / @robj3d3",
    "published": "2026-09-17",
    "relation": "uses_jev",
    "confidence": "probable",
    "status": "published",
    "isOriginal": false,